{
  "$schema": "https://json-schema.org/draft/2020-12/schema",
  "$id": "https://egopulse.local/gate3/v01/harness-fixture-envelope-v0.1.schema.json",
  "title": "V-01 Gate 3 Harness Adapter Contract Fixture Envelope",
  "type": "object",
  "additionalProperties": false,
  "required": ["schemaVersion", "fixtureId", "category", "requirementRefs", "principal", "startingState", "command", "expected"],
  "properties": {
    "schemaVersion": { "const": "v01-harness-fixture/v0.1" },
    "fixtureId": { "type": "string", "minLength": 1 },
    "category": { "enum": ["valid", "invalid", "duplicate", "stale", "unauthorized", "recovery"] },
    "requirementRefs": { "type": "array", "minItems": 1, "items": { "type": "string", "minLength": 1 } },
    "principal": {
      "type": "object",
      "additionalProperties": false,
      "required": ["kind", "principalId", "authenticated"],
      "properties": {
        "kind": { "enum": ["HARNESS_REGISTRY", "COLLABORATION_CONTROL", "HARNESS_ADAPTER", "POLICY_AUTHORITY", "FOUNDER_AUTHORITY", "HARNESS", "UNAUTHENTICATED"] },
        "principalId": { "type": "string", "minLength": 1 },
        "authenticated": { "type": "boolean" }
      }
    },
    "startingState": { "type": ["object", "null"] },
    "resolvedReferences": { "type": "object" },
    "command": { "type": "object", "minProperties": 1, "maxProperties": 1 },
    "safeProjection": { "type": "object" },
    "credentialVariantVectors": { "type": "array" },
    "streamingCredentialBoundaryContract": { "type": "object" },
    "additionalCandidateVectors": { "type": "object" },
    "limitMarkerCanonicalVectors": { "type": "array" },
    "canonicalVectors": { "type": "object" },
    "canonicalVector": { "type": "object" },
    "expected": {
      "type": "object",
      "additionalProperties": true,
      "required": ["outcome", "businessWriteCount"],
      "properties": {
        "outcome": { "enum": ["committed", "replayed", "error"] },
        "businessWriteCount": { "type": "integer", "minimum": 0, "maximum": 1 }
      }
    }
  }
}
