{
  "schemaVersion": "v01-harness-fixture/v0.1", "fixtureId": "harness-valid-artifact-return-candidate", "category": "valid",
  "requirementRefs": ["AC-03", "AC-04", "C03-RETURN-01"], "principal": { "kind": "HARNESS_ADAPTER", "principalId": "adapter:codex", "authenticated": true },
  "startingState": { "attemptStatus": "ATTEMPT_STATUS_RUNNING", "taskStatus": "TASK_STATUS_ACTIVE", "fencingToken": 3, "lastObservationSequence": 8 },
  "resolvedReferences": { "outputManifest": { "digestValid": true }, "workspaceDelta": { "digestValid": true }, "sideEffectLedger": { "complete": true }, "usageReceipt": { "valid": true } },
  "command": { "ingestObservation": { "observationId": "obs-return-001", "adapterId": "codex-adapter", "attemptId": "attempt-001", "dispatchId": "dispatch-001", "fencingToken": 3, "observationSequence": 9, "nativeEventId": "turn.completed:turn-opaque-001", "nativeEventDigestSha256": "e4e4e4e4e4e4e4e4e4e4e4e4e4e4e4e4e4e4e4e4e4e4e4e4e4e4e4e4e4e4e4e4", "capabilityProfileId": "codex-app-server-v2-0.148.0-alpha.15", "criticality": "OBSERVATION_CRITICALITY_ARTIFACT", "rawEvidenceRef": "raw-turn-completed-001", "artifactReturn": { "returnReceiptId": "return-candidate-001", "returnDigestSha256": "e5e5e5e5e5e5e5e5e5e5e5e5e5e5e5e5e5e5e5e5e5e5e5e5e5e5e5e5e5e5e5e5", "nativeCompletionRef": "turn-opaque-001", "outputManifestRef": "output-manifest-001", "outputManifestSha256": "e6e6e6e6e6e6e6e6e6e6e6e6e6e6e6e6e6e6e6e6e6e6e6e6e6e6e6e6e6e6e6e6", "workspaceDeltaRef": "workspace-delta-001", "sideEffectLedgerRef": "side-effects-001", "usageReceiptRef": "usage-001", "finalMessageRef": "message-opaque-001" } } },
  "expected": { "outcome": "committed", "resultingObservationSequence": 9, "returnCandidateAvailable": true, "artifactSetCreated": false, "attemptStatusUnchanged": "ATTEMPT_STATUS_RUNNING", "taskStatusUnchanged": "TASK_STATUS_ACTIVE", "businessWriteCount": 1 }
}
