{
  "schemaVersion": "v01-harness-fixture/v0.1", "fixtureId": "harness-valid-governed-approval-decision", "category": "valid",
  "requirementRefs": ["C03-APPROVAL-02", "QA-04"], "principal": { "kind": "POLICY_AUTHORITY", "principalId": "policy-authority:test", "authenticated": true },
  "startingState": { "approvalRequestId": "approval-001", "requestActionDigest": "e3e3e3e3e3e3e3e3e3e3e3e3e3e3e3e3e3e3e3e3e3e3e3e3e3e3e3e3e3e3e3e3", "decision": null, "fencingToken": 3 },
  "resolvedReferences": { "authorityDecision": { "decisionRef": "policy-decision-001", "valid": true, "scope": "allow_once", "attemptId": "attempt-001", "fencingToken": 3 } },
  "command": { "decideApproval": { "meta": { "commandId": "cmd-approve-once-001", "idempotencyKey": "approve-once-001", "idempotencyScope": "approval-001", "requestDigestSha256": "a2a2a2a2a2a2a2a2a2a2a2a2a2a2a2a2a2a2a2a2a2a2a2a2a2a2a2a2a2a2a2a2", "issuedAt": "2026-08-23T04:12:30Z", "correlationId": "corr-harness-012a" }, "attemptId": "attempt-001", "dispatchId": "dispatch-001", "fencingToken": 3, "approvalRequestId": "approval-001", "actionDigestSha256": "e3e3e3e3e3e3e3e3e3e3e3e3e3e3e3e3e3e3e3e3e3e3e3e3e3e3e3e3e3e3e3e3", "decision": "APPROVAL_DECISION_ALLOW_ONCE", "authorityDecisionRef": "policy-decision-001", "nativeRoutingRef": "native-approval-route-001" } },
  "expected": { "outcome": "committed", "deliveryDisposition": "DELIVERY_DISPOSITION_DELIVERED", "decision": "APPROVAL_DECISION_ALLOW_ONCE", "persistentNativePolicyMutation": false, "nativeDecisionCount": 1, "businessWriteCount": 1 }
}
