{
  "schemaVersion": "v01-harness-fixture/v0.1", "fixtureId": "harness-valid-dispatch-delivery", "category": "valid",
  "requirementRefs": ["AC-02", "C03-DISPATCH-01", "QA-01"],
  "principal": { "kind": "COLLABORATION_CONTROL", "principalId": "collaboration-control:test", "authenticated": true },
  "startingState": { "attemptStatus": "ATTEMPT_STATUS_DISPATCH_PENDING", "fencingToken": 3, "nativeDispatchCount": 0 },
  "resolvedReferences": { "capabilityProfile": { "profileId": "codex-app-server-v2-0.148.0-alpha.15", "active": true, "schemaSha256": "b4e8157096dd054c008a4f1b538fb6cd8f1f2cb9577a97a4afef59c2296ed608" }, "inputBundle": { "digestValid": true }, "policies": { "allActive": true } },
  "command": { "dispatch": { "meta": { "commandId": "cmd-dispatch-001", "idempotencyKey": "dispatch-001", "idempotencyScope": "attempt-001", "requestDigestSha256": "d0d0d0d0d0d0d0d0d0d0d0d0d0d0d0d0d0d0d0d0d0d0d0d0d0d0d0d0d0d0d0d0", "issuedAt": "2026-08-23T04:01:00Z", "correlationId": "corr-harness-002" }, "runId": "run-001", "runRevision": 5, "stepId": "step-001", "stepRevision": 3, "attemptId": "attempt-001", "attemptRevision": 3, "dispatchId": "dispatch-001", "dispatchFingerprint": "d1d1d1d1d1d1d1d1d1d1d1d1d1d1d1d1d1d1d1d1d1d1d1d1d1d1d1d1d1d1d1d1", "fencingToken": 3, "capabilityProfileRef": { "contractId": "codex-app-server-v2-0.148.0-alpha.15", "version": "1", "sha256": "d2d2d2d2d2d2d2d2d2d2d2d2d2d2d2d2d2d2d2d2d2d2d2d2d2d2d2d2d2d2d2d2" }, "inputBundleRef": "input-001", "inputBundleSha256": "d3d3d3d3d3d3d3d3d3d3d3d3d3d3d3d3d3d3d3d3d3d3d3d3d3d3d3d3d3d3d3d3", "workspaceRef": "workspace-001", "budgetProfileRef": { "contractId": "v01-budget", "version": "0.1", "sha256": "d4d4d4d4d4d4d4d4d4d4d4d4d4d4d4d4d4d4d4d4d4d4d4d4d4d4d4d4d4d4d4d4" }, "sandboxProfileRef": { "contractId": "workspace-write-sandbox", "version": "0.1", "sha256": "d5d5d5d5d5d5d5d5d5d5d5d5d5d5d5d5d5d5d5d5d5d5d5d5d5d5d5d5d5d5d5d5" }, "toolPolicyRef": { "contractId": "v01-tool-policy", "version": "0.1", "sha256": "d6d6d6d6d6d6d6d6d6d6d6d6d6d6d6d6d6d6d6d6d6d6d6d6d6d6d6d6d6d6d6d6" }, "dataEgressPolicyRef": { "contractId": "v01-egress-policy", "version": "0.1", "sha256": "d7d7d7d7d7d7d7d7d7d7d7d7d7d7d7d7d7d7d7d7d7d7d7d7d7d7d7d7d7d7d7d7" }, "approvalPolicyRef": { "contractId": "v01-approval-policy", "version": "0.1", "sha256": "d8d8d8d8d8d8d8d8d8d8d8d8d8d8d8d8d8d8d8d8d8d8d8d8d8d8d8d8d8d8d8d8" }, "sessionStrategy": "NATIVE_SESSION_STRATEGY_CREATE_NEW", "routeBinding": { "providerBootstrapProfileId": "gpt-codex-default", "selectedHarnessId": "codex_app_server", "providerModelId": "gpt-5.6-sol", "catalogSnapshotSha256": "aaaaaaaaaaaaaaaaaaaaaaaaaaaaaaaaaaaaaaaaaaaaaaaaaaaaaaaaaaaaaaaa", "capabilityProfileId": "codex-app-server-v2-0.148.0-alpha.15", "routeBindingSha256": "5fc3d40c5d3ecdc61ccac5826e0e2d0b10131133adcd8a5ca8438188c01c39a8" } } },
  "expected": { "outcome": "committed", "deliveryDisposition": "DELIVERY_DISPOSITION_DELIVERED", "nativeDispatchCount": 1, "harnessAccepted": false, "attemptStatusAfterReceipt": "ATTEMPT_STATUS_DISPATCHED", "routeBindingPersistedBeforeNativeSend": true, "historicRouteBindingRecomputed": false, "businessWriteCount": 1 }
}
