{
  "schemaVersion": "v01-harness-fixture/v0.1",
  "fixtureId": "harness-valid-attest-codex-profile",
  "category": "valid",
  "requirementRefs": ["D-01", "C03-CAP-01", "AC-09", "QA-07"],
  "principal": { "kind": "HARNESS_REGISTRY", "principalId": "harness-registry:test", "authenticated": true },
  "startingState": { "registryRevision": 0 },
  "resolvedReferences": { "probe": { "probeId": "probe-codex-001", "realModelCall": true, "schemaGenerated": true } },
  "command": { "attestCapability": { "meta": { "commandId": "cmd-cap-001", "idempotencyKey": "cap-codex-001", "idempotencyScope": "harness-registry", "requestDigestSha256": "c0c0c0c0c0c0c0c0c0c0c0c0c0c0c0c0c0c0c0c0c0c0c0c0c0c0c0c0c0c0c0c0", "issuedAt": "2026-08-23T04:00:00Z", "correlationId": "corr-harness-001" }, "expectedRegistryRevision": 0, "profileId": "codex-app-server-v2-0.148.0-alpha.15", "declaration": { "declarationId": "decl-codex-001", "adapterId": "codex-adapter", "harnessId": "codex", "resourceType": "HARNESS_RESOURCE_TYPE_NATIVE_MODEL_HARNESS", "nativeProtocol": { "protocolName": "codex-app-server", "protocolVersion": "v2", "schemaSha256": "b4e8157096dd054c008a4f1b538fb6cd8f1f2cb9577a97a4afef59c2296ed608", "adapterVersion": "0.1.0", "nativeExecutableVersion": "0.148.0-alpha.15" }, "providerSelectors": ["openai"], "modelFamilySelectors": ["codex-compatible"], "inputContractRefs": [{ "contractId": "governed-repository-change-input", "version": "0.1", "sha256": "c1c1c1c1c1c1c1c1c1c1c1c1c1c1c1c1c1c1c1c1c1c1c1c1c1c1c1c1c1c1c1c1" }], "outputContractRefs": [{ "contractId": "repository-change-return-candidate", "version": "0.1", "sha256": "c2c2c2c2c2c2c2c2c2c2c2c2c2c2c2c2c2c2c2c2c2c2c2c2c2c2c2c2c2c2c2c2" }], "approvalKinds": ["APPROVAL_KIND_COMMAND", "APPROVAL_KIND_FILE_CHANGE", "APPROVAL_KIND_NETWORK", "APPROVAL_KIND_PERMISSION"], "semantics": { "structuredDispatch": "SUPPORT_LEVEL_NATIVE_STRUCTURED", "structuredEvents": "SUPPORT_LEVEL_NATIVE_STRUCTURED", "approvalRequests": "SUPPORT_LEVEL_NATIVE_STRUCTURED", "artifactReturn": "SUPPORT_LEVEL_ADAPTER_EMULATED", "usageReceipts": "SUPPORT_LEVEL_NATIVE_STRUCTURED", "checkpointRefs": "SUPPORT_LEVEL_UNSUPPORTED", "sideEffectReceipts": "SUPPORT_LEVEL_ADAPTER_EMULATED", "governedUserVisibleContent": "SUPPORT_LEVEL_ADAPTER_EMULATED", "cancellation": "CANCELLATION_SEMANTICS_NATIVE_COOPERATIVE", "resume": ["RESUME_SEMANTICS_SESSION_CONTINUE"], "eventOrdering": "EVENT_ORDERING_GUARANTEE_ADAPTER_DURABLE_MONOTONIC" }, "sandboxProfileRef": { "contractId": "workspace-write-sandbox", "version": "0.1", "sha256": "c3c3c3c3c3c3c3c3c3c3c3c3c3c3c3c3c3c3c3c3c3c3c3c3c3c3c3c3c3c3c3c3" }, "toolPolicyRef": { "contractId": "v01-tool-policy", "version": "0.1", "sha256": "c4c4c4c4c4c4c4c4c4c4c4c4c4c4c4c4c4c4c4c4c4c4c4c4c4c4c4c4c4c4c4c4" }, "dataEgressPolicyRef": { "contractId": "v01-egress-policy", "version": "0.1", "sha256": "c5c5c5c5c5c5c5c5c5c5c5c5c5c5c5c5c5c5c5c5c5c5c5c5c5c5c5c5c5c5c5c5" }, "trustProfileRef": { "contractId": "external-harness-trust", "version": "0.1", "sha256": "c6c6c6c6c6c6c6c6c6c6c6c6c6c6c6c6c6c6c6c6c6c6c6c6c6c6c6c6c6c6c6c6" }, "declaredAt": "2026-08-23T04:00:00Z" }, "attestationLevel": "ATTESTATION_LEVEL_PROBE_VERIFIED", "attestationEvidenceRefs": ["probe-codex-001", "schema-sha256:b4e8157096dd054c008a4f1b538fb6cd8f1f2cb9577a97a4afef59c2296ed608"], "validUntil": "2026-09-23T04:00:00Z" } },
  "expected": { "outcome": "committed", "resultingRegistryRevision": 1, "profileRevision": 1, "profileStatus": "CAPABILITY_PROFILE_STATUS_ACTIVE", "profileDigestCreated": true, "partialExecutionResumeClaimed": false, "businessWriteCount": 1 }
}
